Date,Description,Link,EarningRelated
06/03/2017 00:00:00,Analog Devices Announces Final Regulatory Approval and Closing Date for Acquisition of Linear Technology Corporation,,0
02/03/2017 00:00:00,"Analog Devices to Webcast Annual Meeting of Shareholders Wednesday, March 8, 2017 at 9:00 a.m. ET",,0
27/02/2017 00:00:00,"Analog Devices To Participate At The Morgan Stanley Technology, Media & Telecom Conference",,0
21/02/2017 00:00:00,Analog Devices Extends Autonomous Driving Leadership with Drive360TM 28nm CMOS RADAR Technology Platform,,0
15/02/2017 00:00:00,Analog Devices Reports Strong Start to Fiscal Year 2017,,1
14/02/2017 00:00:00,Analog Devices Selects Arrow Electronics as Strategic Global Distribution Channel Partner,,0
14/02/2017 00:00:00,Analog Devices Announces 7 Percent Increase in Quarterly Cash Dividend to $0.45 Per Share; Represents Annual Dividend of $1.80 Per Share,,1
06/02/2017 00:00:00,Analog Devices Sponsors AAAS Family Science Days,,0
26/01/2017 00:00:00,"Analog Devices, Inc. to Report First Quarter Fiscal Year 2017 Financial Results on Wednesday, February 15, 2017",,1
18/01/2017 00:00:00,Analog Devices Announces Changes to Membership of Board of Directors,,0
04/01/2017 00:00:00,Analog Devices To Participate At The J.P. Morgan Tech Forum at CES,,0
03/01/2017 00:00:00,Analog Devices to Receive 2017 IEEE Corporate Innovation Award,,0
06/12/2016 00:00:00,Analog Devices Completes Long-Term Debt Financing Arrangements for Proposed Acquisition of Linear Technology Corporation,,0
01/12/2016 00:00:00,Analog Devices To Participate At The Raymond James Technology Investors Conference,,0
01/12/2016 00:00:00,Analog Devices and China Electric Power Research Institute Collaborate to Improve Reliability of Smart Substations,,0
30/11/2016 00:00:00,Analog Devices Announces Offering and Pricing of Senior Notes,,0
22/11/2016 00:00:00,Analog Devices Reports Fourth Quarter and Fiscal Year 2016 Results,,1
17/11/2016 00:00:00,Analog Devices Acquires Laser Beam Steering Technology from Vescent Photonics to Enable Mainstream Adoption of Automotive LIDAR Systems,,0
08/11/2016 00:00:00,Integrated Accelerometer/Gyro Combo Series from Analog Devices Helps Improve Reliability and Accuracy of Automotive Safety Systems,,0
08/11/2016 00:00:00,Analog Devices Makes MEMS Switch Technology a Commercial Reality,,0
03/11/2016 00:00:00,"Analog Devices' High-Resolution, Low-Power SAR ADC Ensures Shorter Test Times and Product Development Cycles",,0
02/11/2016 00:00:00,Analog Devices' RS-485 Transceivers First to Meet Stringent IEC Surge Standards,,0
31/10/2016 00:00:00,"Analog Devices, Inc. to Report Fourth Quarter and Fiscal Year 2016 Financial Results on Tuesday, November 22, 2016",,1
27/10/2016 00:00:00,Analog Devices Acquires Innovasic,,0
25/10/2016 00:00:00,Analog Devices Collaborates with ARM to Improve Security and Energy Efficiency for IoT Connected Devices,,0
25/10/2016 00:00:00,Analog Devices and Dell EMC Collaborate on IoT Solution for Monitoring Real-Time Health and Safety of First Responders in Dangerous Conditions,,0
20/10/2016 00:00:00,Analog Devices and Linear Technology Announce Antitrust Clearances in the United States and Germany,,0
19/10/2016 00:00:00,Precision Tactical Grade MEMS IMU Delivers Breakthrough System Level Advancements for Positioning and Navigation Applications,,0
18/10/2016 00:00:00,Highly Integrated AFE for Power Quality Monitoring Saves Significant Design Time and Cost Versus Custom Development,,0
06/10/2016 00:00:00,"Analog Devices' Low Power AFE Enables Smaller, Lighter Wearable Health Devices with Longer Battery Life",,0
03/10/2016 00:00:00,Analog Devices' MEMS Accelerometers Enable Early Detection of Structural Defects,,0
29/09/2016 00:00:00,Analog Devices Announces New $5 Billion Term Loan Facility and $1 Billion Upsized Revolving Credit Facility in Connection with Proposed Acquisition of Linear Technology Corporation,,0
21/09/2016 00:00:00,Analog Devices' Rx/Tx Converters Enable More Reliable Mobile Infrastructure for High-Quality Phone Service,,0
20/09/2016 00:00:00,ADI Expands Portfolio of High Performance RF and Microwave Standard Modules to Facilitate Rapid Prototyping and Faster Time to Market,,0
13/09/2016 00:00:00,Data Acquisition System Protects Smart Grid Equipment from Harmful Faults While Improving Power Delivery,,0
24/08/2016 00:00:00,Analog Devices To Participate At The Citi Global Technology Conference,,0
18/08/2016 00:00:00,Analog Devices Adds Cybersecurity Software and Services Capabilities across Its Portfolio with New Acquisition,,0
17/08/2016 00:00:00,Analog Devices Reports Third Quarter 2016 Results,,1
