Date,Description,Link,EarningRelated
27/07/2023 00:00:00,"Analog Devices, Inc. to Report Third Quarter Fiscal Year 2023 Financial Results on Wednesday, August 23, 2023",,1
26/07/2023 00:00:00,Analog Devices Invests More Than $1 Billion in Semiconductor Facility Expansion in Oregon,,0
13/07/2023 00:00:00,"Analog Devices Releases 2022 Environment, Social and Governance Report",,0
22/06/2023 00:00:00,"Analog Devices Recognized by JLR as Winner of Supplier Excellence Awards, Demonstrating Strength of Companies’ Ongoing Partnership",,0
13/06/2023 00:00:00,"Analog Devices Announces Apollo MxFE Advanced Software-Defined Signal Processing Solution for Aerospace & Defense, Instrumentation, and Next-Generation Wireless Communications",,0
09/06/2023 00:00:00,Analog Devices to Participate in the NASDAQ International Investor Conference,,0
05/06/2023 00:00:00,Analog Devices Appoints Stephen Jennings to its Board of Directors,,0
02/06/2023 00:00:00,Analog Devices to Participate in the Stifel 2023 Cross Sector Insight Conference,,0
26/05/2023 00:00:00,Analog Devices to Participate in the Bernstein Strategic Decisions Conference,,0
24/05/2023 00:00:00,Analog Devices Reports Record Revenue for the Second Quarter Fiscal 2023,,1
18/05/2023 00:00:00,Analog Devices Announces CFO Transition,,0
15/05/2023 00:00:00,Analog Devices Announces Investment of €630 Million in Next Generation Semiconductor R&D and Manufacturing Facility in Limerick,,0
27/04/2023 00:00:00,"Analog Devices, Inc. to Report Second Quarter Fiscal Year 2023 Financial Results on Wednesday, May 24, 2023",,1
24/04/2023 00:00:00,Analog Devices Appoints Alan Lee as Chief Technology Officer,,0
10/03/2023 00:00:00,Analog Devices Accelerates Sustainability with Intelligent Solutions at embedded world 2023,,0
08/03/2023 00:00:00,Envision Energy Leverages MEMS Sensor Technology by Analog Devices to Build Smarter and Safer Wind Turbines,,0
27/02/2023 00:00:00,Reference Design Platform by Analog Devices Reduces Time to Market for Radio Designers,,0
23/02/2023 00:00:00,Analog Devices and Marvell Showcase Next-Generation 5G Massive MIMO Radio Unit Platform at Mobile World Congress 2023,,0
16/02/2023 00:00:00,Join Analog Devices at MWC 2023 and Experience the Future of Connectivity Today,,0
15/02/2023 00:00:00,Analog Devices Reports Record First Quarter Fiscal 2023 Results,,1
14/02/2023 00:00:00,Analog Devices Raises Quarterly Dividend By 13%,,1
25/01/2023 00:00:00,"Analog Devices, Inc. to Report First Quarter Fiscal Year 2023 Financial Results on Wednesday, February 15, 2023",,1
03/01/2023 00:00:00,Analog Devices to Participate in the J.P. Morgan Tech/Auto Forum,,0
13/12/2022 00:00:00,Join Analog Devices at CES 2023 to Experience Life at the Intelligent Edge,,0
09/12/2022 00:00:00,Analog Devices to Participate in Oppenheimer 5G Summit,,0
28/11/2022 00:00:00,Analog Devices to Participate in the Barclays Global TMT Conference,,0
23/11/2022 00:00:00,Analog Devices to Participate in Credit Suisse Technology Conference,,0
22/11/2022 00:00:00,Analog Devices Reports Record Fourth Quarter and Fiscal 2022 Results,,1
17/11/2022 00:00:00,AMD and Analog Devices Resolve Patent Infringement Lawsuits,,0
16/11/2022 00:00:00,"Analog Devices Announces World’s First Long-Reach, Single-pair Power over Ethernet (SPoE) Solutions for Smart Building and Factory Automation",,0
07/11/2022 00:00:00,"UMass Lowell, Analog Devices, and the Analog Devices Foundation Collaborate to Advance Student Learning in Science and Engineering With New RF/Microwave Learning Lab",,0
02/11/2022 00:00:00,"Analog Devices and AUO Team Up to Introduce Safe, Power Efficient Widescreen Displays to the Automotive Market",,0
26/10/2022 00:00:00,"Analog Devices, Inc. to Report Fourth Quarter and Fiscal Year 2022 Financial Results on Tuesday, November 22, 2022",,1
13/10/2022 00:00:00,Analog Devices and Keysight Technologies Join Forces to Advance the Adoption of Phased Array Technology,,0
06/10/2022 00:00:00,Analog Devices Announces Expiration and Final Results of Exchange Offer and Consent Solicitation for Maxim Notes,,0
22/09/2022 00:00:00,"Analog Devices Announces Results of Early Tender in Exchange Offer and Consent Solicitation for Maxim Notes, Receipt of Requisite Consents and Extension of Early Tender Premium to Expiration Date",,0
16/09/2022 00:00:00,Analog Devices to Participate in J.P. Morgan 13th Annual U.S. All Stars Conference,,0
08/09/2022 00:00:00,Analog Devices Announces Pricing of Public Offering of Senior Notes,,0
08/09/2022 00:00:00,Analog Devices Announces Commencement of Exchange Offer and Consent Solicitation for Maxim Notes,,0
06/09/2022 00:00:00,Analog Devices to Participate in Citi's 2022 Global Technology Conference,,0
02/09/2022 00:00:00,Analog Devices to Participate in the Evercore ISI 2nd Annual Technology Conference,,0
17/08/2022 00:00:00,Analog Devices Reports Record Third Quarter Fiscal 2022 Results,,1
27/07/2022 00:00:00,"Analog Devices, Inc. to Report Third Quarter Fiscal Year 2022 Financial Results on Wednesday, August 17, 2022",,1
27/06/2022 00:00:00,Analog Devices Appoints André Andonian to its Board of Directors,,0
09/06/2022 00:00:00,Analog Devices to Participate in the NASDAQ Investor Conference,,0
07/06/2022 00:00:00,Analog Devices to Participate in the Bank of America 2022 Global Technology Conference,,0
03/06/2022 00:00:00,Analog Devices to Participate in the Goldman Sachs Global Semiconductor Conference,,0
27/05/2022 00:00:00,Analog Devices to Participate in the Bernstein Strategic Decisions Conference,,0
19/05/2022 00:00:00,"Analog Devices to Participate in the J.P. Morgan Technology, Media and Communications Conference",,0
18/05/2022 00:00:00,Analog Devices Reports Record Second Quarter Fiscal 2022 Results,,1
26/04/2022 00:00:00,"Analog Devices, Inc. to Report Second Quarter Fiscal Year 2022 Financial Results on Wednesday, May 18, 2022",,1
05/04/2022 00:00:00,Analog Devices Outlines Strong Strategic Vision and New Financial Model at 2022 Investor Day,,0
31/03/2022 00:00:00,Analog Devices’ Wireless Battery Management System Achieves Top Automotive Cybersecurity Qualification,,0
28/03/2022 00:00:00,Analog Devices and Gridspertise Join Forces to Advance Smart Grid Resiliency and Electrification Worldwide,,0
14/03/2022 00:00:00,Analog Devices to Host 2022 Investor Day on April 5,,0
07/03/2022 00:00:00,Analog Devices Names Gregory Bryant to the New Position of EVP and President of Business Units,,0
04/03/2022 00:00:00,Analog Devices Invests €100 Million in Europe Operations with ADI Catalyst Launch,,0
02/03/2022 00:00:00,Analog Devices to Participate in the Raymond James Institutional Investors Conference,,0
16/02/2022 00:00:00,Analog Devices Reports Record First Quarter Fiscal 2022 Results,,1
15/02/2022 00:00:00,Analog Devices Raises Quarterly Dividend By 10%,,1
27/01/2022 00:00:00,"Analog Devices, Inc. to Report First Quarter Fiscal Year 2022 Financial Results on Wednesday, February 16, 2022",,1
19/01/2022 00:00:00,Vincent Roche to Succeed Ray Stata as Chair of Analog Devices in 2022,,0
03/01/2022 00:00:00,Analog Devices to Participate in the J.P. Morgan Tech/Auto Forum,,0
09/12/2021 00:00:00,Analog Devices’ RadioVerse® SoC Drives 5G Radio Efficiency and Performance,,0
03/12/2021 00:00:00,Analog Devices to Participate in the UBS Global TMT Conference,,0
02/12/2021 00:00:00,Analog Devices to Participate in the Barclays Global TMT Conference,,0
30/11/2021 00:00:00,Analog Devices to Participate in the Wells Fargo TMT Summit,,0
29/11/2021 00:00:00,Analog Devices to Participate in the Goldman Sachs Global Sustainability Forum,,0
24/11/2021 00:00:00,Analog Devices to Participate in the Credit Suisse Technology Conference,,0
23/11/2021 00:00:00,Analog Devices Reports Record Fourth Quarter and Fiscal 2021 Results,,1
27/10/2021 00:00:00,"Analog Devices, Inc. to Report Fourth Quarter and Fiscal Year 2021 Financial Results on Tuesday, November 23, 2021",,1
05/10/2021 00:00:00,"Analog Devices Announces Inaugural Sustainability-Linked Bond Issuance, a First in the U.S. Technology Sector",,0
05/10/2021 00:00:00,Analog Devices Announces Expiration of Tender Offer for Senior Notes,,0
04/10/2021 00:00:00,Analog Devices Announces Pricing of Tender Offer for Senior Notes,,0
28/09/2021 00:00:00,Analog Devices Announces Pricing of Public Offering of Senior Notes,,0
28/09/2021 00:00:00,Analog Devices Announces Tender Offer for Senior Notes,,0
28/09/2021 00:00:00,Analog Devices Announces Public Offering of Senior Notes,,0
22/09/2021 00:00:00,Analog Devices’ Wireless BMS Helps Lotus Cars Redefine Mobility in its Electric Vehicles,,0
14/09/2021 00:00:00,Analog Devices Appoints Janene Asgeirsson as Chief Legal Officer,,0
13/09/2021 00:00:00,Analog Devices to Participate in Citi’s Global Technology Virtual Conference,,0
08/09/2021 00:00:00,Analog Devices Details Updated Capital Allocation Priorities & Accelerated Accretion Timeline for Maxim Acquisition,,0
07/09/2021 00:00:00,Analog Devices Announces $2.5 Billion Accelerated Share Repurchase and Updates Fourth Quarter Outlook,,1
26/08/2021 00:00:00,Analog Devices Completes Acquisition of Maxim Integrated,,0
25/08/2021 00:00:00,Analog Devices Increases Share Repurchase Authorization by $8.5 Billion to Approximately $10 Billion,,0
23/08/2021 00:00:00,Analog Devices and Maxim Integrated Announce China Antitrust Clearance for Combination,,0
18/08/2021 00:00:00,Analog Devices Reports Record Revenue and Earnings for the Third Quarter Fiscal 2021,,1
29/07/2021 00:00:00,"Analog Devices, Inc. to Report Third Quarter Fiscal Year 2021 Financial Results on Wednesday, August 18, 2021",,1
24/06/2021 00:00:00,Analog Devices Completes Allocation of Semiconductor Industry’s First Green Bond,,0
23/06/2021 00:00:00,Analog Devices Announces $2.5 Billion Sustainability-Linked Revolving Credit Facility,,0
23/06/2021 00:00:00,Analog Devices Recognized by General Motors as Winner of Coveted Overdrive Award,,0
21/06/2021 00:00:00,Analog Devices and Keysight Collaborate to Speed Development of O-RAN Solutions,,0
17/06/2021 00:00:00,"Analog Devices Announces Long-Reach Industrial Ethernet Offerings to Achieve Last Mile Connectivity in Process, Factory and Building Automation",,0
10/06/2021 00:00:00,Analog Devices to Participate in NASDAQ Investor Conference,,0
04/06/2021 00:00:00,Analog Devices to Participate in Bank of America Securities Global Technology Conference and Stifel Cross Sector Insight Conference,,0
03/06/2021 00:00:00,"Analog Devices to Participate in Evercore ISI Technology, Media and Telecom Conference",,0
01/06/2021 00:00:00,Analog Devices to Participate in Bernstein’s Strategic Decisions Conference,,0
26/05/2021 00:00:00,Analog Devices Expands BMS Portfolio to Enable Continuous Battery Monitoring,,0
24/05/2021 00:00:00,"Analog Devices to Participate in J.P. Morgan Global Technology, Media and Communications Conference",,0
19/05/2021 00:00:00,Analog Devices Reports Record Revenue and Earnings for the Second Quarter Fiscal 2021,,1
22/04/2021 00:00:00,"Analog Devices, Inc. to Report Second Quarter Fiscal Year 2021 Financial Results on Wednesday, May 19, 2021",,1
20/04/2021 00:00:00,Woods Hole Oceanographic Institution and Analog Devices Launch Ocean and Climate Innovation Accelerator,,0
12/04/2021 00:00:00,Analog Devices Advances Climate Strategy and Commits to Net Zero Emissions by 2050,,0
07/04/2021 00:00:00,"Analog Devices and MDA Collaborate to Provide Electronic Beam Forming Technology for the Telesat Lightspeed Constellation, Enhancing Global Connectivity",,0
25/03/2021 00:00:00,Analog Devices Announces Complete Radio Platform for 5G O-RAN Ecosystem,,0
25/03/2021 00:00:00,Independent Research Surveys Manufacturing Executives: Real-Time Data from Connected Factory is Key to Driving Innovation and Delivering Competitive Advantages,,0
26/02/2021 00:00:00,Analog Devices to Participate in Raymond James Institutional Investors Conference,,0
25/02/2021 00:00:00,"Analog Devices to Participate in Morgan Stanley Technology, Media and Telecom Conference",,0
24/02/2021 00:00:00,"Analog Devices, University of Limerick and Stripe Collaborate to Leverage Software Technology for the Transformation of Engineering Education",,0
22/02/2021 00:00:00,Analog Devices’ Battery Management System ICs and Automotive Audio Bus Power Volvo’s All Electric XC40 SUV,,0
22/02/2021 00:00:00,Analog Devices Appoints Anelise Sacks as Chief Customer Officer,,0
17/02/2021 00:00:00,Analog Devices Reports First Quarter Fiscal 2021 Results at the High End of Guidance,,1
16/02/2021 00:00:00,Analog Devices Raises Quarterly Dividend By 11%,,1
21/01/2021 00:00:00,"Analog Devices, Inc. to Report First Quarter Fiscal Year 2021 Financial Results on Wednesday, February 17, 2021",,1
08/01/2021 00:00:00,Analog Devices to Participate in the Goldman Sachs Technology & Internet Conference and the J.P. Morgan Tech/Auto Forum,,0
07/12/2020 00:00:00,"Analog Devices to Participate in the Barclays Global Technology, Media and Telecommunications Conference",,0
07/12/2020 00:00:00,Analog Devices to Participate in the Raymond James Virtual Technology Investor Conference,,0
30/11/2020 00:00:00,Analog Devices to Participate in the Credit Suisse 24th Annual Technology Conference,,0
30/11/2020 00:00:00,Analog Devices to Participate in Nasdaq’s 43rd Investor Conference,,0
24/11/2020 00:00:00,Analog Devices Reports Fourth Quarter Results Above the High-End of Outlook,,1
29/10/2020 00:00:00,"Analog Devices, Inc. to Report Fourth Quarter Fiscal Year 2020 Financial Results on Tuesday, November 24, 2020",,1
22/10/2020 00:00:00,NEC and Analog Devices Collaborate to Provide 5G O-RAN Massive MIMO Radio for Rakuten Mobile,,0
08/10/2020 00:00:00,Analog Devices and Maxim Integrated Shareholders Approve Combination,,0
22/09/2020 00:00:00,Analog Devices Collaborates with Microsoft to Mass Produce State-of-the-Art 3D Imaging Products and Solutions,,0
11/09/2020 00:00:00,Analog Devices to Participate in Deutsche Bank’s Virtual Technology Conference,,0
09/09/2020 00:00:00,Analog Devices Introduces Automotive Industry’s First Wireless Battery Management System for Electric Vehicles,,0
04/09/2020 00:00:00,Analog Devices to Participate in Citi’s 2020 Global Technology Virtual Conference,,0
21/08/2020 00:00:00,Analog Devices to Participate in the BMO 2020 Virtual Technology Summit,,0
19/08/2020 00:00:00,Analog Devices Reports Third Quarter Fiscal 2020 Results With Revenue and EPS Above the Midpoint of Guidance,,1
18/08/2020 00:00:00,Analog Devices Appoints Dr. Laurie H. Glimcher to Board of Directors,,0
03/08/2020 00:00:00,Analog Devices Collaborates with Intel on Radio Platform for Addressing 5G Network Design Challenges,,0
27/07/2020 00:00:00,"Analog Devices Acquires HDMI Business From INVECAS, Expanding High Performance Audiovisual Capabilities",,0
23/07/2020 00:00:00,"Analog Devices, Inc. to Report Third Quarter Fiscal Year 2020 Financial Results on Wednesday, August 19, 2020",,1
13/07/2020 00:00:00,"Analog Devices Announces Combination with Maxim Integrated, Strengthening Analog Semiconductor Leadership",,0
13/07/2020 00:00:00,Analog Devices Raises Third Quarter Fiscal 2020 Guidance,,1
16/06/2020 00:00:00,University of Limerick and Analog Devices Announce Scholarship Programs,,0
29/05/2020 00:00:00,Analog Devices to Participate in the Bank of America Securities 2020 Global Technology Conference,,0
22/05/2020 00:00:00,Analog Devices to Participate in Bernstein’s Annual Strategic Decisions Conference,,0
20/05/2020 00:00:00,Analog Devices Reports Second Quarter Fiscal 2020 Results,,1
23/04/2020 00:00:00,"Analog Devices, Inc. to Report Second Quarter Fiscal Year 2020 Financial Results on Wednesday, May 20, 2020",,1
20/04/2020 00:00:00,"Analog Devices Foundation Donates $500,000 to Massachusetts General Hospital’s Vaccine & Immunotherapy Center (VIC) to Advance COVID-19 Vaccine Development and Testing",,0
08/04/2020 00:00:00,Analog Devices Closes Semiconductor Industry’s First Green Bond,,0
06/04/2020 00:00:00,Analog Devices Contributes to Global Fight Against COVID-19,,0
30/03/2020 00:00:00,Analog Devices Takes Action to Support Customers During COVID-19 Pandemic,,0
26/03/2020 00:00:00,Analog Devices Provides a Business Update Related to COVID-19,,0
27/02/2020 00:00:00,Analog Devices to Participate in Raymond James Institutional Investors Conference,,0
19/02/2020 00:00:00,Analog Devices Reports First Quarter Fiscal 2020 Results,,1
18/02/2020 00:00:00,Analog Devices Raises Quarterly Dividend By 15%,,1
24/01/2020 00:00:00,"Analog Devices, Inc. to Report First Quarter Fiscal Year 2020 Financial Results on Wednesday, February 19, 2020",,1
22/01/2020 00:00:00,Analog Devices Collaborates with Hyundai Motor Company to Launch Industry’s First All-Digital Road Noise Cancellation System,,0
03/01/2020 00:00:00,Analog Devices to Participate in the J.P. Morgan Tech/Auto Forum,,0
05/12/2019 00:00:00,Analog Devices Files Patent Infringement Lawsuit Against Xilinx,,0
02/12/2019 00:00:00,Rimac Chooses Analog Devices to Enable Precision Battery Management in High Performance Electric Vehicles,,0
27/11/2019 00:00:00,Analog Devices to Participate in the Credit Suisse Technology Conference,,0
26/11/2019 00:00:00,Analog Devices Appoints Dr. Susie Wee to Board of Directors,,0
26/11/2019 00:00:00,Analog Devices Reports Fourth Quarter and Fiscal 2019 Results,,1
31/10/2019 00:00:00,"Analog Devices, Inc. to Report Fourth Quarter and Fiscal Year 2019 Financial Results on Tuesday, November 26, 2019",,1
29/10/2019 00:00:00,Analog Devices Acquires Test Motors to Expand Condition-Based Monitoring Offerings for Industry 4.0,,0
24/09/2019 00:00:00,Analog Garage to Hold Event on Autonomous Driving’s Future,,0
03/09/2019 00:00:00,Analog Devices to Participate in the Citi Global Technology Conference,,0
21/08/2019 00:00:00,Analog Devices Reports Third Quarter Fiscal 2019 Results with Revenue and EPS above the Midpoint of Guidance,,1
30/07/2019 00:00:00,"Analog Devices Recognized for Employee Benefits, Work Culture, and Business Growth",,0
25/07/2019 00:00:00,"Analog Devices, Inc. to Report Third Quarter Fiscal Year 2019 Financial Results on Wednesday, August 21, 2019",,1
26/06/2019 00:00:00,Analog Devices Honors Top Suppliers at Inaugural Supplier Day 2019,,0
06/06/2019 00:00:00,Analog Devices to Participate in Stifel 2019 Cross Sector Insight Conference,,0
30/05/2019 00:00:00,Analog Devices Announces Breakthrough Solution to Accelerate mmWave 5G Wireless Network Infrastructure,,0
24/05/2019 00:00:00,Analog Devices to Participate in Bernstein Strategic Decisions Conference,,0
22/05/2019 00:00:00,Analog Devices Reports Second Quarter Fiscal 2019 Results with Revenue and EPS at the High-End of Guidance,,1
24/04/2019 00:00:00,"Analog Devices, Inc. to Report Second Quarter Fiscal Year 2019 Financial Results on Wednesday, May 22, 2019",,1
23/04/2019 00:00:00,Dan Leibholz Named Chief Technology Officer at Analog Devices,,0
27/03/2019 00:00:00,Analog Garage to Hold Boston Innovation Labs Event for Startups,,0
28/02/2019 00:00:00,Analog Devices to Participate in Raymond James Institutional Investors Conference,,0
27/02/2019 00:00:00,Analog Devices Ranks #17 Among World’s 100 Most Sustainable Corporations,,0
22/02/2019 00:00:00,"Analog Devices to Participate in Morgan Stanley Technology, Media & Telecom Conference",,0
20/02/2019 00:00:00,Analog Devices Reports First Quarter Fiscal 2019 Results with Revenue and EPS at the High-End of Guidance,,1
19/02/2019 00:00:00,Analog Devices Announces 12.5 Percent Increase in Dividend; Raises Annual Dividend Growth Target to 7% to 15%,,1
06/02/2019 00:00:00,"Analog Devices Expands Raleigh, NC Presence with Move to The Dillon",,0
05/02/2019 00:00:00,"Larry Weiss to Join Analog Devices as Vice President, General Counsel and Secretary",,0
04/02/2019 00:00:00,BYD Selects Analog Devices’ Audio Bus and Processor Technologies to Improve Vehicle Energy Efficiency and Enhance Infotainment Experience,,0
23/01/2019 00:00:00,"Analog Devices, Inc. to Report First Quarter Fiscal Year 2019 Financial Results on Wednesday, February 20, 2019",,1
04/01/2019 00:00:00,Analog Devices to Participate in J.P. Morgan Tech/Auto Forum,,0
17/12/2018 00:00:00,Anantha Chandrakasan to join the Analog Devices Board of Directors,,0
12/12/2018 00:00:00,Analog Devices Recognized for Environmental Stewardship with Associated Industries of Massachusetts (AIM) 2018 Sustainability Award,,0
30/11/2018 00:00:00,Analog Devices to Participate in Raymond James 2018 Technology Investors Conference,,0
26/11/2018 00:00:00,"Analog Devices to Participate in Credit Suisse Technology, Media & Telecom Conference",,0
26/11/2018 00:00:00,"Analog Devices Recognized as a Top Place to Work, Employer of Choice",,0
20/11/2018 00:00:00,"Analog Devices Reports Strong Fourth Quarter Results, Achieving Record Revenue and EPS; Full-Year Fiscal 2018 Revenue Surpasses $6 Billion",,1
13/11/2018 00:00:00,Analog Devices Announces Industrial Automation Solutions to Help Accelerate the Path to Industry 4.0,,0
22/10/2018 00:00:00,"Analog Devices, Inc. to Report Fourth Quarter and Fiscal Year 2018 Financial Results on Tuesday, November 20, 2018",,1
30/08/2018 00:00:00,Analog Devices to Participate in the Citi 2018 Global Technology Conference,,0
22/08/2018 00:00:00,Analog Devices Reports Strong Third Quarter Results with Revenue Above the High-End of Guidance and Double-Digit year-over-year EPS Growth,,1
21/08/2018 00:00:00,Analog Devices Reinstates Share Repurchase Program; Increases Authorization by $2 Billion,,0
25/07/2018 00:00:00,"Analog Devices, Inc. to Report Third Quarter Fiscal Year 2018 Financial Results on Wednesday, August 22, 2018",,1
12/07/2018 00:00:00,"Analog Devices Breaks Ground on New Global Headquarters in Wilmington, MA",,0
10/07/2018 00:00:00,Analog Devices Collaborates with Baidu on Project Apollo to Advance Autonomous Driving,,0
14/06/2018 00:00:00,Analog Devices Welcomes Karen Golz to Board of Directors,,0
11/06/2018 00:00:00,Industry's Widest Bandwidth RF Transceiver Speeds Development of 2G-5G Base Stations and Phased Array Radar,,0
31/05/2018 00:00:00,Analog Devices to Participate at The Bank of America Merrill Lynch 2018 Global Technology Conference,,0
30/05/2018 00:00:00,"Analog Devices Reports Second Quarter Revenue Above the High-End of Guidance Led by Double-Digit YoY B2B Growth, and Record Operating and Free Cash Flow",,1
16/05/2018 00:00:00,Analog Devices' Plug-and-Play Antenna Chip Simplifies Phased Array Radar for Avionics and Communications Equipment Designers,,0
07/05/2018 00:00:00,Analog Devices Names Four Fellows for Outstanding Technical Achievement and Leadership,,0
02/05/2018 00:00:00,"Analog Devices, Inc. to Report Second Quarter Fiscal Year 2018 Financial Results on Wednesday, May 30, 2018",,1
25/04/2018 00:00:00,Analog Devices Opens New Bengaluru Facility,,0
06/04/2018 00:00:00,Analog Devices Named Top 100 Global Technology Leader by Thomson Reuters,,0
09/03/2018 00:00:00,Analog Devices Announces Offering and Pricing of Senior Notes,,0
08/03/2018 00:00:00,Analog Devices Adds Innovative RADAR Technology for Industrial and Automotive Markets with Acquisition of Symeo GmbH,,0
28/02/2018 00:00:00,"Analog Devices Reports Year-over-Year Revenue Growth at the High-End of Guidance, Strong Profit Conversion, and Substantial Debt Reduction in First Quarter 2018 Earnings",,1
27/02/2018 00:00:00,Analog Devices Announces 7 Percent Increase in Quarterly Cash Dividend to $0.48 Per Share; Represents Annual Dividend of $1.92 Per Share,,1
01/02/2018 00:00:00,"Analog Devices, Inc. to Report First Quarter Fiscal Year 2018 Financial Results on Wednesday, February 28, 2018",,1
27/11/2017 00:00:00,ADI CEO Vincent Roche to Deliver Keynote at Credit Suisse Conference,,0
21/11/2017 00:00:00,Analog Devices Reports Fourth Quarter and Fiscal Year 2017 Results,,1
02/11/2017 00:00:00,"Analog Devices, Inc. to Report Fourth Quarter and Fiscal Year 2017 Financial Results on Tuesday, November 21, 2017",,1
30/10/2017 00:00:00,Analog Devices Establishes Strategic Relationship with China Mobile IoT,,0
05/09/2017 00:00:00,Analog Devices to Speak at Upcoming Investor Conferences,,0
30/08/2017 00:00:00,Analog Devices Reports Third Quarter 2017 Results,,1
16/08/2017 00:00:00,"Prashanth Mahendra-Rajah to Join Analog Devices as Senior Vice President, Finance and Chief Financial Officer",,0
18/07/2017 00:00:00,"Analog Devices, Inc. to Report Third Quarter Fiscal Year 2017 Financial Results on Wednesday, August 30, 2017",,1
15/06/2017 00:00:00,Analog Devices Reaches LTC Integration Milestone; Announces Senior Executive Team,,0
13/06/2017 00:00:00,"Analog Devices to Webcast Investor Day on Tuesday, June 20, 2017",,0
31/05/2017 00:00:00,Analog Devices Reports Second Quarter 2017 Results,,1
30/05/2017 00:00:00,Co-founder and Chairman Ray Stata Accepts IEEE Award Recognizing Analog Devices for Innovation and Industry Leadership,,0
24/04/2017 00:00:00,Analog Devices' MEMS Accelerometers Deliver Compelling Noise Performance for Condition Monitoring Applications,,0
17/04/2017 00:00:00,"Analog Devices, Inc. to Report Second Quarter Fiscal Year 2017 Financial Results on Wednesday, May 31, 2017",,1
11/04/2017 00:00:00,Analog Devices and Renesas Electronics Collaborate on 77/79-GHz Automotive RADAR Technology to Improve ADAS Applications and Enable Autonomous Vehicles,,0
30/03/2017 00:00:00,Analog Devices Acquires Broadband GaAs and GaN Amplifier Expert OneTree Microdevices to Enable Complete Cable Infrastructure Solutions,,0
14/03/2017 00:00:00,Analog Devices' Ultralow Power Accelerometer Enables Remote IoT Edge Nodes to Monitor Asset Health,,0
14/03/2017 00:00:00,Ultra Low Power MCU Enables 10 Times System-Level Power Savings and Floating-Point Operation in IoT Applications,,0
10/03/2017 00:00:00,Analog Devices Completes Acquisition of Linear Technology,,0
